{
  "artifact_hashes": {
    "Dockerfile": "804553eb48e934045022d50d69e42b3f28dea787ee4af910dbb4bcb486601d58",
    "ops/deployment/Caddyfile.example": "ff95fdc50eeb54b857bea96a679d316b814568c3ed41dfccdbc2eba022cb0901",
    "ops/deployment/README.md": "88ed93a3129ccb6a3ce4d1e1d7c0b20aee89a1542ea84ed86a4bc2ecb6ddd66e",
    "ops/deployment/docker-compose.prod.yml": "b71ba65937b8a5cc2415977db274f3279b9ebcf100943d4e0730b35bbe5bf6ab",
    "ops/deployment/secrets/.gitignore": "aae815b9313ef60fb99d51bec324f3de1cea5256d6bbf58a660578b3e2d5815c",
    "security/owasp_mcp/evidence/hardened_deployment_and_secret_delivery_2026-03-13.md": "71bdeacf2baf54072e07b215af1eb73e0c149ef1a9859f2ae51136e05ff429fa"
  },
  "attestation_id": "owasp-mcp-hardened-runtime-and-secret-delivery-2026-03-13",
  "control_ids": [
    "OMCP-DEPLOY-001",
    "OMCP-DEPLOY-002"
  ],
  "environment": "prod-strict",
  "evidence_uri": "security/owasp_mcp/evidence/hardened_deployment_and_secret_delivery_2026-03-13.md",
  "expires_at": "2026-09-14T00:00:00Z",
  "notes": "The reference deployment runs non-root, keeps the app on an internal network, blocks public metrics exposure, and injects secrets from Docker secrets via *_FILE variables. Revalidated against current repository artifacts on 2026-06-16.",
  "title": "Runtime hardening and secret-file delivery are configured for production",
  "verified_at": "2026-06-16T14:35:00Z",
  "verifier": "Codex with repository-owner evidence refresh"
}
